{
  "content_sha256": "11978ddb60baccae87b809972e8477eb8d0ce61c21c457b1a9f9ad4523ed9459",
  "episodes": [
    {
      "episode_id": "episode-0",
      "failure_state": null,
      "final_raw_tuples": [
        [
          5,
          9
        ]
      ],
      "resolution_events": [
        {
          "collision_count": 1,
          "raw_sid": [
            5,
            9
          ],
          "raw_valid": true,
          "resolved_normalized_item_id": 7
        }
      ],
      "steps": [
        {
          "mask_positions_after": [
            1
          ],
          "mask_positions_before": [
            0,
            1
          ],
          "position_topk": [
            {
              "position": 0,
              "topk": [
                {
                  "logprob": -0.1,
                  "rank": 1,
                  "token_id": 5
                },
                {
                  "logprob": -0.2,
                  "rank": 2,
                  "token_id": 6
                }
              ]
            }
          ],
          "pruned_beams": [],
          "retained_beams": [
            "beam-0"
          ],
          "selected_order": [
            0
          ],
          "selected_positions": [
            0
          ],
          "step_index": 0
        },
        {
          "mask_positions_after": [],
          "mask_positions_before": [
            1
          ],
          "position_topk": [
            {
              "position": 1,
              "topk": [
                {
                  "logprob": -0.1,
                  "rank": 1,
                  "token_id": 9
                },
                {
                  "logprob": -0.2,
                  "rank": 2,
                  "token_id": 10
                }
              ]
            }
          ],
          "pruned_beams": [],
          "retained_beams": [
            "beam-0"
          ],
          "selected_order": [
            1
          ],
          "selected_positions": [
            1
          ],
          "step_index": 1
        }
      ],
      "termination_state": "success"
    }
  ],
  "method_family": "masked_diffusion",
  "payload_id": "fixture:masked_diffusion",
  "privacy": {
    "absolute_private_paths_exported": false,
    "source_item_ids_exported": false,
    "source_user_ids_exported": false
  },
  "schema": "sidscope.trace_payload.masked_diffusion.v1",
  "schema_revision": "1.0.0"
}
